{
    "$schema": "https://json-schema.org/draft/2020-12/schema",
    "$id": "https://construct.net/sdk/schema/effect.addon.schema.json",
    "title": "Effect addon.json",
    "description": "Main JSON file that describes metadata about an effect.",
    "type": "object",
    "properties": {
        "is-c3-addon": {
            "description": "This is used by Construct to identify valid addons.",
            "const": true
        },
        "type": {
            "description": "Indicates the addon type. For the effect schema, this must be \"effect\".",
            "const": "effect"
        },
        "name": {
            "description": "The displayed name of the addon, in English. This can be changed after release.",
            "type": "string"
        },
        "id": {
            "description": "The unique ID of the addon. This must not be used by any other addon ever published for Construct, and must never change after you first publish your addon. It is recommended to use a vendor-specific prefix, e.g. MyCompany_MyAddon.",
            "type": "string"
        },
        "version": {
            "description": "A string specifying the addon version in four parts (major, minor, patch, revision).",
            "type": "string"
        },
        "author": {
            "description": "A string identifying the author of the addon.",
            "type": "string"
        },
        "website": {
            "description": "A string of a URL to the author's website. It is recommended to provide updates to the addon at this URL if any become available. The website should use HTTPS.",
            "type": "string",
            "format": "uri"
        },
        "documentation": {
            "description": "A string of a URL to the online documentation for the addon. It is important to provide documentation for your addon to be useful to users.",
            "type": "string",
            "format": "uri"
        },
        "description": {
            "description": "A string of a brief description of what the addon does, displayed when prompting the user to install the addon.",
            "type": "string"
        },
        "file-list": {
            "description": "A list of all files used by the addon. Required for Developer Mode addons to work.",
            "type": "array",
            "items": { "type": "string" }
        },
        "category": {
            "description": "The category the effect should appear in.",
            "enum": ["3d", "blend", "color", "distortion", "mask", "normal-mapping", "other", "tiling"]
        },
        "supported-renderers": {
            "description": "An array of strings indicating the supported renderers for this effect.",
            "type": "array",
            "items": {
                "enum": ["webgl", "webgl2", "webgpu"]
            },
            "minItems": 1,
            "uniqueItems": true
        },
        "blends-background": {
            "description": "Boolean indicating whether the effect blends with the background.",
            "type": "boolean"
        },
        "uses-depth": {
            "description": "Boolean indicating whether the effect samples the depth buffer.",
            "type": "boolean"
        },
        "cross-sampling": {
            "description": "Boolean indicating whether a background-blending effect has inconsistent sampling of the background and foreground.",
            "type": "boolean"
        },
        "preserves-opaqueness": {
            "description": "Boolean indicating whether the effect preserves opaque pixels, i.e. every input pixel with an alpha of 1 is also output with an alpha of 1.",
            "type": "boolean"
        },
        "animated": {
            "description": "Boolean indicating whether the effect is animated, i.e. changes over time.",
            "type": "boolean"
        },
        "must-predraw": {
            "description": "Boolean indicating whether to force the pre-draw step.",
            "type": "boolean"
        },
        "extend-box": {
            "description": "Amount to extend the rendered box horizontally and vertically.",
            "type": "object",
            "properties": {
                "horizontal": {
                    "type": "number"
                },
                "vertical": {
                    "type": "number"
                }
            }
        },
        "is-deprecated": {
            "description": "Boolean to indicate a deprecated effect. This hides the effect from the 'Add effect' dialog, but allows existing projects to continue using it. This allows an effect to be phased out without breaking projects.",
            "type": "boolean"
        },
        "parameters": {
            "description": "An array of parameters that the effect uses.",
            "type": "array",
            "items": {
                "type": "object",
                "properties": {
                    "id": {
                        "description": "String of a unique ID for this parameter.",
                        "type": "string"
                    },
                    "c2id": {
                        "description": "The corresponding ID used in a compatible legacy Construct 2 effect if this is not the same as \"id\".",
                        "type": "string"
                    },
                    "type": {
                        "description": "The type of the effect parameter.",
                        "enum": ["float", "percent", "color"]
                    },
                    "initial-value": {
                        "description": "The initial value of the shader uniform, in the format the shader uses it (i.e. 0-1 range for percent parameters).",
                        "anyOf": [
                            { "type": "number" },
                            { "type": "array", "items": { "type": "number" }, "minItems": 3, "maxItems": 3 }
                        ]
                    },
                    "uniform": {
                        "description": "For WebGL shaders only, the name of the corresponding uniform in the shader.",
                        "type": "string"
                    },
                    "interpolatable": {
                        "description": "A boolean indicating whether this effect parameter can be interpolated with a timeline.",
                        "type": "boolean"
                    }
                }
            },
            "required": ["id", "type", "initial-value"]
        }
    },
    "required": ["is-c3-addon", "type", "name", "id", "version", "author", "website", "documentation", "description", "category", "parameters"]
}
    