{
	"$schema": "../effect.addon.schema.json",
	
	"is-c3-addon": true,
	"type": "effect",
	"name": "WebGL 2 effect",
	"id": "MyCompany_WebGL2Effect",
	
	"supported-renderers": ["webgl", "webgl2", "webgpu"],
	
	"version": "1.0.0.0",
	"author": "Scirra",
	"website": "https://www.construct.net",
	"documentation": "https://www.construct.net",
	"description": "Demonstrates WebGL 2 shader variants by displaying red with WebGL 1 and green with WebGL 2 (and blue with WebGPU).",
	"file-list": [
		"lang/en-US.json",
		"addon.json",
		"effect.fx",
		"effect.webgl2.fx",
		"effect.wgsl"
	],
	
	"category": "color",
	"blends-background": false,
	"cross-sampling": false,
	"preserves-opaqueness": true,
	"animated": false,
	"extend-box": {
		"horizontal": 0,
		"vertical": 0
	},
	
	"parameters": []
}